{
  "blocked_on": [],
  "checkpoint": "EG.golden",
  "claims_validated": [
    "report-matches-verdict"
  ],
  "evidence_used": [
    "rep",
    "sc"
  ],
  "families_run": [
    "authority_verdict"
  ],
  "findings": [
    {
      "claim_id": "report-matches-verdict",
      "evidence_refs": [
        "rep",
        "sc"
      ],
      "family_id": "authority_verdict",
      "reason": "single effective product verdict 'pass'; public surfaces do not overclaim",
      "remediation": "",
      "risk_ref": null,
      "status": "PASS"
    }
  ],
  "gate": "validator",
  "risk_references_used": [],
  "schema_version": "validator.result.v1",
  "status": "PASS_WITH_WARNINGS",
  "warnings": [
    "artifact 'scratch' is not declared in the source boundary; it cannot satisfy required proof"
  ]
}
